{
  "$schema": "https://json-schema.org/draft/2020-12/schema",
  "title": "Song",
  "type": "object",
  "required": ["id", "title", "verses"],
  "properties": {
    "id": { "type": "string", "minLength": 1 },
    "number": { "type": "string" },
    "title": { "type": "string", "minLength": 1 },
    "subtitle": { "type": "string" },
    "language": { "type": "string", "minLength": 2 },
    "authors": { "type": "array", "items": { "type": "string" } },
    "topics": { "type": "array", "items": { "type": "string" } },
    "copyright": { "type": "string" },
    "ccli": { "type": "string" },
    "verses": {
      "type": "array",
      "minItems": 1,
      "items": {
        "type": "object",
        "required": ["id", "lines"],
        "properties": {
          "id": { "type": "string" },
          "lines": {
            "type": "array",
            "minItems": 1,
            "items": { "type": "string" }
          }
        },
        "additionalProperties": false
      }
    },
    "refrain": {
      "type": "object",
      "required": ["id", "lines"],
      "properties": {
        "id": { "type": "string", "const": "R" },
        "lines": {
          "type": "array",
          "minItems": 1,
          "items": { "type": "string" }
        }
      },
      "additionalProperties": false
    },
    "verseOrder": {
      "type": "array",
      "items": { "type": "string" }
    },
    "notes": { "type": "string" },
    "createdAt": { "type": "string", "format": "date-time" },
    "updatedAt": { "type": "string", "format": "date-time" }
  },
  "additionalProperties": false
}
